{
  "$schema": "https://json-schema.org/draft/2020-12/schema",
  "$id": "https://example.invalid/dacn/d0/policy_decision.schema.json",
  "title": "policy_decision d0-v1",
  "type": "object",
  "additionalProperties": false,
  "required": [
    "schema_version",
    "decision_id",
    "call_id",
    "case_id",
    "expected_revision",
    "outcome",
    "reason_code",
    "reasons",
    "effective_limits",
    "policy_version",
    "evaluated_at"
  ],
  "properties": {
    "schema_version": {
      "type": "string",
      "minLength": 1,
      "pattern": "^d0-v1$"
    },
    "decision_id": {
      "type": "string",
      "minLength": 1,
      "pattern": "^POL-[A-Za-z0-9_-]{8,100}$"
    },
    "call_id": {
      "type": "string",
      "minLength": 1
    },
    "case_id": {
      "type": "string",
      "minLength": 1
    },
    "expected_revision": {
      "type": "integer",
      "minimum": 1
    },
    "outcome": {
      "type": "string",
      "minLength": 1,
      "enum": [
        "ALLOW",
        "DENY",
        "REQUIRE_APPROVAL"
      ]
    },
    "reason_code": {
      "type": "string",
      "minLength": 1
    },
    "reasons": {
      "type": "array",
      "items": {
        "type": "string",
        "minLength": 1
      }
    },
    "effective_limits": {
      "$ref": "limits.schema.json"
    },
    "policy_version": {
      "type": "string",
      "minLength": 1
    },
    "evaluated_at": {
      "type": "string",
      "minLength": 1,
      "pattern": "^\\d{4}-\\d{2}-\\d{2}T\\d{2}:\\d{2}:\\d{2}(?:\\.\\d+)?(?:Z|[+-]\\d{2}:\\d{2})$"
    }
  }
}
