{
  "schema_version": "d0-v1",
  "decision_id": "POL-fixture0001",
  "call_id": "CALL-fixture0001",
  "case_id": "CASE-fixture0001",
  "expected_revision": 1,
  "outcome": "ALLOW",
  "reason_code": "static_readonly_allowed",
  "reasons": [
    "Target revalidation still required at execution"
  ],
  "effective_limits": {
    "timeout_ms": 30000,
    "max_output_bytes": 65536,
    "max_artifact_bytes": 1048576,
    "max_concurrency": 1
  },
  "policy_version": "policy-v1",
  "evaluated_at": "2026-10-23T10:00:00Z"
}
